id,product_name,brand,category,skin_type,key_ingredients,benefits,size_ml,price_idr,rating,review_count,image_url,description
976,Olay Balance Vitamin C Glow Oil,Olay,Facial Oil,Sensitive,Vitamin C; Green Tea; Allantoin; Peptide,Pore care; Barrier repair,40,336000,4.3,23263,https://raw.githubusercontent.com/github/explore/main/topics/java/java.png?seed=skincare976,"Facial Oil for sensitive skin with Vitamin C, Green Tea to support pore care & barrier repair."
977,Somethinc Daily Retinol Balancing Toner,Somethinc,Toner,Dry,Retinol; Peptide; Green Tea,Soothing; Oil control,120,102000,3.9,46635,https://raw.githubusercontent.com/github/explore/main/topics/go/go.png?seed=skincare977,"Toner for dry skin with Retinol, Peptide to support soothing & oil control."
978,Avoskin Radiance Panthenol Sunscreen Gel,Avoskin,Sunscreen,Oily,Panthenol; Vitamin C; Salicylic Acid,Barrier repair; Oil control; Hydrating,35,106000,4.8,45530,https://raw.githubusercontent.com/github/explore/main/topics/ruby/ruby.png?seed=skincare978,"Sunscreen for oily skin with Panthenol, Vitamin C to support barrier repair & oil control."
979,Pyunkang Yul Advanced Vitamin C Foam Cleanser,Pyunkang Yul,Cleanser,All,Vitamin C; Green Tea; Hyaluronic Acid,Anti-acne; Barrier repair,200,182000,3.7,43051,https://raw.githubusercontent.com/github/explore/main/topics/php/php.png?seed=skincare979,"Cleanser for all skin with Vitamin C, Green Tea to support anti-acne & barrier repair."
980,Bioderma Ultra Panthenol Eye Treatment,Bioderma,Eye Cream,All,Panthenol; Allantoin; Vitamin C,Soothing; Hydrating,30,337000,4.0,1926,https://raw.githubusercontent.com/github/explore/main/topics/swift/swift.png?seed=skincare980,"Eye Cream for all skin with Panthenol, Allantoin to support soothing & hydrating."
981,Somethinc Renew Salicylic Acid Soothing Mask,Somethinc,Face Mask,Oily,Salicylic Acid; Hyaluronic Acid,Anti-acne; Oil control; Anti-aging,30,101000,3.8,31005,https://raw.githubusercontent.com/github/explore/main/topics/kotlin/kotlin.png?seed=skincare981,"Face Mask for oily skin with Salicylic Acid, Hyaluronic Acid to support anti-acne & oil control."
982,Innisfree Pure Salicylic Acid Cream Cleanser,Innisfree,Cleanser,All,Salicylic Acid; AHA/BHA,Anti-acne; Pore care,120,107000,4.1,17912,https://raw.githubusercontent.com/github/explore/main/topics/docker/docker.png?seed=skincare982,"Cleanser for all skin with Salicylic Acid, AHA/BHA to support anti-acne & pore care."
983,Nivea Hydra Vitamin C Gel Moisturizer,Nivea,Moisturizer,All,Vitamin C; Allantoin; Tranexamic Acid; Squalane,Barrier repair; Pore care; Anti-acne,50,95000,3.8,45966,https://raw.githubusercontent.com/github/explore/main/topics/kubernetes/kubernetes.png?seed=skincare983,"Moisturizer for all skin with Vitamin C, Allantoin to support barrier repair & pore care."
984,Olay Calm Niacinamide Sun Fluid,Olay,Sunscreen,Dry,Niacinamide; Vitamin C; Allantoin; Squalane,Soothing; Pore care,30,273000,4.5,35296,https://raw.githubusercontent.com/github/explore/main/topics/aws/aws.png?seed=skincare984,"Sunscreen for dry skin with Niacinamide, Vitamin C to support soothing & pore care."
985,Olay Pro Allantoin Nourishing Oil,Olay,Facial Oil,Sensitive,Allantoin; AHA/BHA; Green Tea; Niacinamide,Barrier repair; Anti-acne; Hydrating,20,153000,4.0,4650,https://raw.githubusercontent.com/github/explore/main/topics/azure/azure.png?seed=skincare985,"Facial Oil for sensitive skin with Allantoin, AHA/BHA to support barrier repair & anti-acne."
986,Avoskin Pure Vitamin C Soothing Toner,Avoskin,Toner,Combination,Vitamin C; Salicylic Acid; Centella Asiatica,Brightening; Hydrating; Anti-acne,120,268000,4.6,12538,https://raw.githubusercontent.com/github/explore/main/topics/linux/linux.png?seed=skincare986,"Toner for combination skin with Vitamin C, Salicylic Acid to support brightening & hydrating."
987,Clinique Hydra Ceramide Peeling Solution,Clinique,Exfoliator,Dry,Ceramide; Salicylic Acid; Peptide,Hydrating; Anti-aging,80,313000,3.8,2037,https://raw.githubusercontent.com/github/explore/main/topics/mongodb/mongodb.png?seed=skincare987,"Exfoliator for dry skin with Ceramide, Salicylic Acid to support hydrating & anti-aging."
988,Olay Renew Retinol Exfoliating Toner,Olay,Exfoliator,Normal,Retinol; Niacinamide,Hydrating; Anti-acne,50,318000,4.2,33537,https://raw.githubusercontent.com/github/explore/main/topics/postgresql/postgresql.png?seed=skincare988,"Exfoliator for normal skin with Retinol, Niacinamide to support hydrating & anti-acne."
989,Innisfree Balance Vitamin C Peeling Solution,Innisfree,Exfoliator,All,Vitamin C; Allantoin,Anti-aging; Barrier repair,100,371000,3.7,42724,https://raw.githubusercontent.com/github/explore/main/topics/javascript/javascript.png?seed=skincare989,"Exfoliator for all skin with Vitamin C, Allantoin to support anti-aging & barrier repair."
990,Azarine Glow Centella Asiatica Eye Treatment,Azarine,Eye Cream,Sensitive,Centella Asiatica; Ceramide,Hydrating; Oil control; Pore care,10,223000,3.9,12799,https://raw.githubusercontent.com/github/explore/main/topics/react/react.png?seed=skincare990,"Eye Cream for sensitive skin with Centella Asiatica, Ceramide to support hydrating & oil control."
991,Somethinc Gentle Retinol Balancing Toner,Somethinc,Toner,All,Retinol; Centella Asiatica; Ceramide; Niacinamide,Hydrating; Oil control; Anti-acne,200,131000,3.9,43706,https://raw.githubusercontent.com/github/explore/main/topics/vue/vue.png?seed=skincare991,"Toner for all skin with Retinol, Centella Asiatica to support hydrating & oil control."
992,Emina Gentle Tranexamic Acid Resurfacing Serum,Emina,Exfoliator,Normal,Tranexamic Acid; Hyaluronic Acid; Allantoin,Oil control; Barrier repair,20,403000,3.7,27317,https://raw.githubusercontent.com/github/explore/main/topics/angular/angular.png?seed=skincare992,"Exfoliator for normal skin with Tranexamic Acid, Hyaluronic Acid to support oil control & barrier repair."
993,Garnier Calm Hyaluronic Acid Peeling Solution,Garnier,Exfoliator,Sensitive,Hyaluronic Acid; Ceramide,Soothing; Hydrating; Oil control,80,187000,4.7,47123,https://raw.githubusercontent.com/github/explore/main/topics/nodejs/nodejs.png?seed=skincare993,"Exfoliator for sensitive skin with Hyaluronic Acid, Ceramide to support soothing & hydrating."
994,Avoskin Pure Panthenol Soothing Toner,Avoskin,Toner,All,Panthenol; Centella Asiatica; Green Tea; Vitamin C,Oil control; Brightening,60,61000,3.9,45954,https://raw.githubusercontent.com/github/explore/main/topics/python/python.png?seed=skincare994,"Toner for all skin with Panthenol, Centella Asiatica to support oil control & brightening."
995,Somethinc Ultra Allantoin Booster Serum,Somethinc,Serum,All,Allantoin; AHA/BHA; Peptide,Pore care; Barrier repair; Anti-aging,50,229000,3.9,39036,https://raw.githubusercontent.com/github/explore/main/topics/java/java.png?seed=skincare995,"Serum for all skin with Allantoin, AHA/BHA to support pore care & barrier repair."
996,Hada Labo Radiance Green Tea Soothing Toner,Hada Labo,Toner,Oily,Green Tea; Centella Asiatica; Tranexamic Acid,Soothing; Anti-aging,100,238000,4.5,38849,https://raw.githubusercontent.com/github/explore/main/topics/go/go.png?seed=skincare996,"Toner for oily skin with Green Tea, Centella Asiatica to support soothing & anti-aging."
997,Vaseline Advanced Allantoin Eye Treatment,Vaseline,Eye Cream,All,Allantoin; Peptide,Oil control; Pore care; Anti-acne,25,259000,3.8,47565,https://raw.githubusercontent.com/github/explore/main/topics/ruby/ruby.png?seed=skincare997,"Eye Cream for all skin with Allantoin, Peptide to support oil control & pore care."
998,Cetaphil Daily Peptide Repair Essence,Cetaphil,Essence,All,Peptide; AHA/BHA,Barrier repair; Anti-acne,60,263000,4.1,14178,https://raw.githubusercontent.com/github/explore/main/topics/php/php.png?seed=skincare998,"Essence for all skin with Peptide, AHA/BHA to support barrier repair & anti-acne."
999,Pyunkang Yul Gentle Hyaluronic Acid Sunscreen Gel,Pyunkang Yul,Sunscreen,Oily,Hyaluronic Acid; Panthenol,Soothing; Barrier repair; Pore care,40,80000,4.4,17142,https://raw.githubusercontent.com/github/explore/main/topics/swift/swift.png?seed=skincare999,"Sunscreen for oily skin with Hyaluronic Acid, Panthenol to support soothing & barrier repair."
1000,Nivea Ultra Peptide Exfoliating Toner,Nivea,Exfoliator,Combination,Peptide; Hyaluronic Acid,Pore care; Anti-acne,50,172000,3.9,32111,https://raw.githubusercontent.com/github/explore/main/topics/kotlin/kotlin.png?seed=skincare1000,"Exfoliator for combination skin with Peptide, Hyaluronic Acid to support pore care & anti-acne."
1001,Olay Balance AHA/BHA Peeling Solution,Olay,Exfoliator,All,AHA/BHA; Retinol; Ceramide,Anti-aging; Barrier repair; Anti-acne,60,228000,4.7,43209,https://raw.githubusercontent.com/github/explore/main/topics/docker/docker.png?seed=skincare1001,"Exfoliator for all skin with AHA/BHA, Retinol to support anti-aging & barrier repair."
1002,Scarlett Calm Centella Asiatica Glow Oil,Scarlett,Facial Oil,Sensitive,Centella Asiatica; Retinol; Vitamin C,Anti-aging; Pore care; Brightening,20,365000,4.4,21745,https://raw.githubusercontent.com/github/explore/main/topics/kubernetes/kubernetes.png?seed=skincare1002,"Facial Oil for sensitive skin with Centella Asiatica, Retinol to support anti-aging & pore care."
1003,Nivea Pure Hyaluronic Acid Cream Cleanser,Nivea,Cleanser,Dry,Hyaluronic Acid; Niacinamide; Vitamin C; Ceramide,Anti-acne; Anti-aging,120,50000,4.6,8414,https://raw.githubusercontent.com/github/explore/main/topics/aws/aws.png?seed=skincare1003,"Cleanser for dry skin with Hyaluronic Acid, Niacinamide to support anti-acne & anti-aging."
1004,Safi Pure Allantoin UV Shield,Safi,Sunscreen,Oily,Allantoin; Vitamin C,Pore care; Anti-aging,60,252000,4.8,19558,https://raw.githubusercontent.com/github/explore/main/topics/azure/azure.png?seed=skincare1004,"Sunscreen for oily skin with Allantoin, Vitamin C to support pore care & anti-aging."
1005,Azarine Hydra Retinol Hydra Cream,Azarine,Moisturizer,Normal,Retinol; Vitamin C,Anti-aging; Anti-acne; Oil control,30,293000,3.6,445,https://raw.githubusercontent.com/github/explore/main/topics/linux/linux.png?seed=skincare1005,"Moisturizer for normal skin with Retinol, Vitamin C to support anti-aging & anti-acne."
1006,Bioderma Calm Peptide Peeling Solution,Bioderma,Exfoliator,Normal,Peptide; Vitamin C,Oil control; Anti-aging; Pore care,60,299000,5.0,44623,https://raw.githubusercontent.com/github/explore/main/topics/mongodb/mongodb.png?seed=skincare1006,"Exfoliator for normal skin with Peptide, Vitamin C to support oil control & anti-aging."
1007,Bioaqua Balance Peptide Soothing Toner,Bioaqua,Toner,All,Peptide; Allantoin; Vitamin C; Tranexamic Acid,Barrier repair; Oil control,150,246000,4.1,48934,https://raw.githubusercontent.com/github/explore/main/topics/postgresql/postgresql.png?seed=skincare1007,"Toner for all skin with Peptide, Allantoin to support barrier repair & oil control."
1008,Cetaphil Ultra Salicylic Acid Glow Oil,Cetaphil,Facial Oil,Dry,Salicylic Acid; Allantoin; Green Tea,Pore care; Anti-acne; Barrier repair,50,481000,4.9,20360,https://raw.githubusercontent.com/github/explore/main/topics/javascript/javascript.png?seed=skincare1008,"Facial Oil for dry skin with Salicylic Acid, Allantoin to support pore care & anti-acne."
1009,Safi Daily Allantoin Hydra Cream,Safi,Moisturizer,Oily,Allantoin; Vitamin C; Squalane,Oil control; Pore care,50,248000,3.9,9330,https://raw.githubusercontent.com/github/explore/main/topics/react/react.png?seed=skincare1009,"Moisturizer for oily skin with Allantoin, Vitamin C to support oil control & pore care."
1010,Innisfree Glow AHA/BHA Balancing Toner,Innisfree,Toner,All,AHA/BHA; Hyaluronic Acid,Soothing; Anti-aging,60,125000,4.7,353,https://raw.githubusercontent.com/github/explore/main/topics/vue/vue.png?seed=skincare1010,"Toner for all skin with AHA/BHA, Hyaluronic Acid to support soothing & anti-aging."
1011,Nivea Pro AHA/BHA Brightening Essence,Nivea,Essence,Sensitive,AHA/BHA; Centella Asiatica; Peptide,Hydrating; Oil control,100,114000,4.1,38961,https://raw.githubusercontent.com/github/explore/main/topics/angular/angular.png?seed=skincare1011,"Essence for sensitive skin with AHA/BHA, Centella Asiatica to support hydrating & oil control."
1012,Bioderma Glow Peptide Gel Cleanser,Bioderma,Cleanser,Dry,Peptide; Salicylic Acid; Retinol; Vitamin C,Pore care; Hydrating; Barrier repair,80,241000,3.7,10083,https://raw.githubusercontent.com/github/explore/main/topics/nodejs/nodejs.png?seed=skincare1012,"Cleanser for dry skin with Peptide, Salicylic Acid to support pore care & hydrating."
1013,Pyunkang Yul Ultra Hyaluronic Acid Treatment Serum,Pyunkang Yul,Serum,All,Hyaluronic Acid; Ceramide; Panthenol; Retinol,Hydrating; Brightening; Soothing,30,431000,3.9,31360,https://raw.githubusercontent.com/github/explore/main/topics/python/python.png?seed=skincare1013,"Serum for all skin with Hyaluronic Acid, Ceramide to support hydrating & brightening."
1014,La Roche-Posay Glow Panthenol Facial Wash,La Roche-Posay,Cleanser,All,Panthenol; Niacinamide; Peptide,Soothing; Anti-acne; Barrier repair,50,251000,4.5,37695,https://raw.githubusercontent.com/github/explore/main/topics/java/java.png?seed=skincare1014,"Cleanser for all skin with Panthenol, Niacinamide to support soothing & anti-acne."
1015,Erha Balance Panthenol Treatment Serum,Erha,Serum,Sensitive,Panthenol; Peptide; Centella Asiatica,Brightening; Hydrating; Anti-aging,15,443000,4.5,37105,https://raw.githubusercontent.com/github/explore/main/topics/go/go.png?seed=skincare1015,"Serum for sensitive skin with Panthenol, Peptide to support brightening & hydrating."
1016,Neutrogena Calm Retinol Glow Oil,Neutrogena,Facial Oil,Combination,Retinol; Hyaluronic Acid; Squalane,Brightening; Barrier repair,20,205000,4.2,17752,https://raw.githubusercontent.com/github/explore/main/topics/ruby/ruby.png?seed=skincare1016,"Facial Oil for combination skin with Retinol, Hyaluronic Acid to support brightening & barrier repair."
1017,Clinique Renew Green Tea Firming Eye Cream,Clinique,Eye Cream,Dry,Green Tea; Hyaluronic Acid; Tranexamic Acid; Salicylic Acid,Barrier repair; Anti-aging; Oil control,25,649000,4.0,16119,https://raw.githubusercontent.com/github/explore/main/topics/php/php.png?seed=skincare1017,"Eye Cream for dry skin with Green Tea, Hyaluronic Acid to support barrier repair & anti-aging."
1018,Hada Labo Hydra Hyaluronic Acid Firming Eye Cream,Hada Labo,Eye Cream,Normal,Hyaluronic Acid; Tranexamic Acid; Retinol,Oil control; Barrier repair,20,77000,4.1,275,https://raw.githubusercontent.com/github/explore/main/topics/swift/swift.png?seed=skincare1018,"Eye Cream for normal skin with Hyaluronic Acid, Tranexamic Acid to support oil control & barrier repair."
1019,Garnier Ultra Peptide Hydrating Essence,Garnier,Essence,Oily,Peptide; Panthenol; Squalane,Soothing; Brightening; Oil control,60,96000,4.2,45712,https://raw.githubusercontent.com/github/explore/main/topics/kotlin/kotlin.png?seed=skincare1019,"Essence for oily skin with Peptide, Panthenol to support soothing & brightening."
1020,Kiehl's Balance Niacinamide Hydro Mask,Kiehl's,Face Mask,Oily,Niacinamide; Allantoin,Brightening; Barrier repair,75,114000,4.5,46937,https://raw.githubusercontent.com/github/explore/main/topics/docker/docker.png?seed=skincare1020,"Face Mask for oily skin with Niacinamide, Allantoin to support brightening & barrier repair."
1021,Somethinc Glow Squalane Foam Cleanser,Somethinc,Cleanser,All,Squalane; Tranexamic Acid,Anti-acne; Soothing,50,144000,4.5,43685,https://raw.githubusercontent.com/github/explore/main/topics/kubernetes/kubernetes.png?seed=skincare1021,"Cleanser for all skin with Squalane, Tranexamic Acid to support anti-acne & soothing."
1022,La Roche-Posay Radiance Allantoin Hydrating Toner,La Roche-Posay,Toner,Sensitive,Allantoin; Salicylic Acid; Niacinamide; Green Tea,Barrier repair; Oil control,120,65000,3.9,48972,https://raw.githubusercontent.com/github/explore/main/topics/aws/aws.png?seed=skincare1022,"Toner for sensitive skin with Allantoin, Salicylic Acid to support barrier repair & oil control."
1023,Wardah Pure Peptide Clay Mask,Wardah,Face Mask,Normal,Peptide; Squalane,Barrier repair; Anti-acne,80,137000,3.9,42421,https://raw.githubusercontent.com/github/explore/main/topics/azure/azure.png?seed=skincare1023,"Face Mask for normal skin with Peptide, Squalane to support barrier repair & anti-acne."
1024,La Roche-Posay Gentle Salicylic Acid Brightening Essence,La Roche-Posay,Essence,Normal,Salicylic Acid; Retinol; Tranexamic Acid; Panthenol,Oil control; Anti-acne,120,114000,4.2,36719,https://raw.githubusercontent.com/github/explore/main/topics/linux/linux.png?seed=skincare1024,"Essence for normal skin with Salicylic Acid, Retinol to support oil control & anti-acne."
1025,Olay Daily Vitamin C Foam Cleanser,Olay,Cleanser,Combination,Vitamin C; Salicylic Acid; Centella Asiatica,Oil control; Pore care,80,156000,3.9,14541,https://raw.githubusercontent.com/github/explore/main/topics/mongodb/mongodb.png?seed=skincare1025,"Cleanser for combination skin with Vitamin C, Salicylic Acid to support oil control & pore care."
1026,Olay Radiance Centella Asiatica Concentrate Serum,Olay,Serum,Sensitive,Centella Asiatica; Panthenol,Pore care; Barrier repair; Anti-aging,15,87000,4.2,1053,https://raw.githubusercontent.com/github/explore/main/topics/postgresql/postgresql.png?seed=skincare1026,"Serum for sensitive skin with Centella Asiatica, Panthenol to support pore care & barrier repair."
1027,Garnier Renew AHA/BHA Balancing Toner,Garnier,Toner,Oily,AHA/BHA; Tranexamic Acid,Anti-aging; Oil control,80,256000,4.2,29955,https://raw.githubusercontent.com/github/explore/main/topics/javascript/javascript.png?seed=skincare1027,"Toner for oily skin with AHA/BHA, Tranexamic Acid to support anti-aging & oil control."
1028,Avoskin Radiance Peptide Skin Essence,Avoskin,Essence,Sensitive,Peptide; Centella Asiatica; Hyaluronic Acid,Brightening; Barrier repair,60,247000,4.1,25992,https://raw.githubusercontent.com/github/explore/main/topics/react/react.png?seed=skincare1028,"Essence for sensitive skin with Peptide, Centella Asiatica to support brightening & barrier repair."
1029,Erha Advanced Retinol Gentle Exfoliator,Erha,Exfoliator,Combination,Retinol; Ceramide; Tranexamic Acid,Anti-acne; Barrier repair; Anti-aging,60,309000,4.5,24417,https://raw.githubusercontent.com/github/explore/main/topics/vue/vue.png?seed=skincare1029,"Exfoliator for combination skin with Retinol, Ceramide to support anti-acne & barrier repair."
1030,CeraVe Calm Vitamin C Exfoliating Toner,CeraVe,Exfoliator,Combination,Vitamin C; Niacinamide,Soothing; Pore care; Anti-acne,20,264000,3.8,24650,https://raw.githubusercontent.com/github/explore/main/topics/angular/angular.png?seed=skincare1030,"Exfoliator for combination skin with Vitamin C, Niacinamide to support soothing & pore care."
1031,Pyunkang Yul Advanced Green Tea Gel Cleanser,Pyunkang Yul,Cleanser,Dry,Green Tea; Niacinamide; Centella Asiatica,Brightening; Hydrating,100,46000,5.0,32281,https://raw.githubusercontent.com/github/explore/main/topics/nodejs/nodejs.png?seed=skincare1031,"Cleanser for dry skin with Green Tea, Niacinamide to support brightening & hydrating."
1032,Nivea Ultra Salicylic Acid Concentrate Serum,Nivea,Serum,All,Salicylic Acid; Hyaluronic Acid,Soothing; Brightening; Pore care,20,384000,4.1,2875,https://raw.githubusercontent.com/github/explore/main/topics/python/python.png?seed=skincare1032,"Serum for all skin with Salicylic Acid, Hyaluronic Acid to support soothing & brightening."
1033,Emina Gentle Salicylic Acid UV Shield,Emina,Sunscreen,Combination,Salicylic Acid; Retinol; Hyaluronic Acid,Pore care; Anti-acne; Barrier repair,40,138000,4.6,45785,https://raw.githubusercontent.com/github/explore/main/topics/java/java.png?seed=skincare1033,"Sunscreen for combination skin with Salicylic Acid, Retinol to support pore care & anti-acne."
1034,Safi Calm Peptide Moisturizing Cream,Safi,Moisturizer,All,Peptide; Vitamin C; Salicylic Acid,Brightening; Barrier repair; Anti-acne,30,236000,3.8,39429,https://raw.githubusercontent.com/github/explore/main/topics/go/go.png?seed=skincare1034,"Moisturizer for all skin with Peptide, Vitamin C to support brightening & barrier repair."
1035,Avoskin Pure Salicylic Acid Skin Essence,Avoskin,Essence,Combination,Salicylic Acid; Allantoin; Panthenol; Green Tea,Brightening; Pore care,100,255000,5.0,1861,https://raw.githubusercontent.com/github/explore/main/topics/ruby/ruby.png?seed=skincare1035,"Essence for combination skin with Salicylic Acid, Allantoin to support brightening & pore care."
1036,Wardah Gentle Squalane Gentle Exfoliator,Wardah,Exfoliator,Normal,Squalane; Salicylic Acid,Soothing; Brightening; Barrier repair,30,240000,4.1,15362,https://raw.githubusercontent.com/github/explore/main/topics/php/php.png?seed=skincare1036,"Exfoliator for normal skin with Squalane, Salicylic Acid to support soothing & brightening."
1037,Pyunkang Yul Advanced Green Tea Brightening Essence,Pyunkang Yul,Essence,Oily,Green Tea; Centella Asiatica,Pore care; Anti-acne,50,278000,3.7,30048,https://raw.githubusercontent.com/github/explore/main/topics/swift/swift.png?seed=skincare1037,"Essence for oily skin with Green Tea, Centella Asiatica to support pore care & anti-acne."
1038,Emina Renew Vitamin C Glow Oil,Emina,Facial Oil,Normal,Vitamin C; Centella Asiatica,Pore care; Anti-acne; Brightening,30,118000,4.8,4587,https://raw.githubusercontent.com/github/explore/main/topics/kotlin/kotlin.png?seed=skincare1038,"Facial Oil for normal skin with Vitamin C, Centella Asiatica to support pore care & anti-acne."
1039,Pyunkang Yul Ultra Vitamin C Sunscreen Gel,Pyunkang Yul,Sunscreen,Combination,Vitamin C; Niacinamide; Centella Asiatica,Pore care; Brightening,40,147000,4.7,49648,https://raw.githubusercontent.com/github/explore/main/topics/docker/docker.png?seed=skincare1039,"Sunscreen for combination skin with Vitamin C, Niacinamide to support pore care & brightening."
1040,Vaseline Daily Salicylic Acid Daily Toner,Vaseline,Toner,Combination,Salicylic Acid; Allantoin; AHA/BHA,Anti-aging; Brightening; Hydrating,80,63000,3.8,10410,https://raw.githubusercontent.com/github/explore/main/topics/kubernetes/kubernetes.png?seed=skincare1040,"Toner for combination skin with Salicylic Acid, Allantoin to support anti-aging & brightening."
1041,La Roche-Posay Balance Ceramide Hydro Mask,La Roche-Posay,Face Mask,Combination,Ceramide; Retinol; Panthenol; Peptide,Anti-aging; Soothing,80,232000,4.6,5830,https://raw.githubusercontent.com/github/explore/main/topics/aws/aws.png?seed=skincare1041,"Face Mask for combination skin with Ceramide, Retinol to support anti-aging & soothing."
1042,Nivea Pro Hyaluronic Acid Glow Oil,Nivea,Facial Oil,Sensitive,Hyaluronic Acid; Allantoin; Salicylic Acid,Pore care; Barrier repair; Soothing,15,303000,4.0,29044,https://raw.githubusercontent.com/github/explore/main/topics/azure/azure.png?seed=skincare1042,"Facial Oil for sensitive skin with Hyaluronic Acid, Allantoin to support pore care & barrier repair."
1043,The Ordinary Advanced Hyaluronic Acid Firming Eye Cream,The Ordinary,Eye Cream,Oily,Hyaluronic Acid; Peptide,Hydrating; Anti-acne; Anti-aging,25,417000,4.5,12331,https://raw.githubusercontent.com/github/explore/main/topics/linux/linux.png?seed=skincare1043,"Eye Cream for oily skin with Hyaluronic Acid, Peptide to support hydrating & anti-acne."
1044,Neutrogena Renew Niacinamide Sun Fluid,Neutrogena,Sunscreen,All,Niacinamide; AHA/BHA; Hyaluronic Acid,Brightening; Hydrating,60,102000,5.0,28950,https://raw.githubusercontent.com/github/explore/main/topics/mongodb/mongodb.png?seed=skincare1044,"Sunscreen for all skin with Niacinamide, AHA/BHA to support brightening & hydrating."
1045,Nivea Daily AHA/BHA Soothing Toner,Nivea,Toner,Sensitive,AHA/BHA; Retinol; Allantoin; Centella Asiatica,Brightening; Anti-acne; Anti-aging,200,103000,3.8,31917,https://raw.githubusercontent.com/github/explore/main/topics/postgresql/postgresql.png?seed=skincare1045,"Toner for sensitive skin with AHA/BHA, Retinol to support brightening & anti-acne."
1046,Cetaphil Advanced Peptide Hydro Mask,Cetaphil,Face Mask,All,Peptide; Niacinamide,Oil control; Hydrating; Pore care,80,129000,4.3,5639,https://raw.githubusercontent.com/github/explore/main/topics/javascript/javascript.png?seed=skincare1046,"Face Mask for all skin with Peptide, Niacinamide to support oil control & hydrating."
1047,Olay Pure Niacinamide UV Shield,Olay,Sunscreen,All,Niacinamide; Panthenol,Hydrating; Barrier repair,60,112000,4.7,26077,https://raw.githubusercontent.com/github/explore/main/topics/react/react.png?seed=skincare1047,"Sunscreen for all skin with Niacinamide, Panthenol to support hydrating & barrier repair."
1048,Vaseline Gentle Centella Asiatica Face Serum,Vaseline,Serum,Combination,Centella Asiatica; Panthenol,Brightening; Barrier repair; Anti-acne,20,234000,4.8,6894,https://raw.githubusercontent.com/github/explore/main/topics/vue/vue.png?seed=skincare1048,"Serum for combination skin with Centella Asiatica, Panthenol to support brightening & barrier repair."
1049,Avoskin Renew Hyaluronic Acid Balancing Toner,Avoskin,Toner,All,Hyaluronic Acid; Green Tea; Retinol; Squalane,Oil control; Brightening,80,266000,3.6,16295,https://raw.githubusercontent.com/github/explore/main/topics/angular/angular.png?seed=skincare1049,"Toner for all skin with Hyaluronic Acid, Green Tea to support oil control & brightening."
1050,Neutrogena Radiance Vitamin C Concentrate Serum,Neutrogena,Serum,Dry,Vitamin C; Tranexamic Acid,Soothing; Anti-acne,30,206000,4.2,42008,https://raw.githubusercontent.com/github/explore/main/topics/nodejs/nodejs.png?seed=skincare1050,"Serum for dry skin with Vitamin C, Tranexamic Acid to support soothing & anti-acne."
