id,product_name,brand,category,skin_type,key_ingredients,benefits,size_ml,price_idr,rating,review_count,image_url,description
1496,Wardah Ultra AHA/BHA Nourishing Oil,Wardah,Facial Oil,Combination,AHA/BHA; Allantoin; Vitamin C,Brightening; Anti-aging; Hydrating,35,395000,4.2,8507,https://raw.githubusercontent.com/github/explore/main/topics/kubernetes/kubernetes.png?seed=skincare1496,"Facial Oil for combination skin with AHA/BHA, Allantoin to support brightening & anti-aging."
1497,Wardah Glow AHA/BHA Repair Oil,Wardah,Facial Oil,All,AHA/BHA; Niacinamide; Tranexamic Acid,Hydrating; Pore care; Anti-acne,30,103000,4.1,35219,https://raw.githubusercontent.com/github/explore/main/topics/aws/aws.png?seed=skincare1497,"Facial Oil for all skin with AHA/BHA, Niacinamide to support hydrating & pore care."
1498,Somethinc Calm Centella Asiatica Soothing Toner,Somethinc,Toner,Oily,Centella Asiatica; Vitamin C; Squalane; Hyaluronic Acid,Brightening; Barrier repair; Soothing,200,274000,3.7,32475,https://raw.githubusercontent.com/github/explore/main/topics/azure/azure.png?seed=skincare1498,"Toner for oily skin with Centella Asiatica, Vitamin C to support brightening & barrier repair."
1499,Azarine Pro Vitamin C Bright Eye Cream,Azarine,Eye Cream,Dry,Vitamin C; Salicylic Acid; Allantoin,Anti-acne; Oil control; Hydrating,10,238000,4.0,23031,https://raw.githubusercontent.com/github/explore/main/topics/linux/linux.png?seed=skincare1499,"Eye Cream for dry skin with Vitamin C, Salicylic Acid to support anti-acne & oil control."
1500,La Roche-Posay Calm Centella Asiatica Hydro Mask,La Roche-Posay,Face Mask,Combination,Centella Asiatica; Retinol,Barrier repair; Oil control,120,276000,3.9,29827,https://raw.githubusercontent.com/github/explore/main/topics/mongodb/mongodb.png?seed=skincare1500,"Face Mask for combination skin with Centella Asiatica, Retinol to support barrier repair & oil control."
1501,Azarine Balance Peptide Treatment Serum,Azarine,Serum,Normal,Peptide; Salicylic Acid; Panthenol; Vitamin C,Pore care; Brightening,30,422000,4.2,13430,https://raw.githubusercontent.com/github/explore/main/topics/postgresql/postgresql.png?seed=skincare1501,"Serum for normal skin with Peptide, Salicylic Acid to support pore care & brightening."
1502,Pyunkang Yul Ultra Panthenol Revive Eye Balm,Pyunkang Yul,Eye Cream,Normal,Panthenol; Vitamin C; Tranexamic Acid; Allantoin,Oil control; Pore care; Hydrating,10,301000,4.9,34776,https://raw.githubusercontent.com/github/explore/main/topics/javascript/javascript.png?seed=skincare1502,"Eye Cream for normal skin with Panthenol, Vitamin C to support oil control & pore care."
1503,Neutrogena Radiance Squalane Hydro Mask,Neutrogena,Face Mask,Dry,Squalane; Niacinamide; Vitamin C,Oil control; Soothing,75,91000,4.0,12944,https://raw.githubusercontent.com/github/explore/main/topics/react/react.png?seed=skincare1503,"Face Mask for dry skin with Squalane, Niacinamide to support oil control & soothing."
1504,Garnier Calm Panthenol Hydrating Toner,Garnier,Toner,Dry,Panthenol; Retinol; Green Tea; Squalane,Oil control; Pore care; Anti-aging,200,190000,4.1,13574,https://raw.githubusercontent.com/github/explore/main/topics/vue/vue.png?seed=skincare1504,"Toner for dry skin with Panthenol, Retinol to support oil control & pore care."
1505,Cetaphil Pro Centella Asiatica Barrier Cream,Cetaphil,Moisturizer,All,Centella Asiatica; Allantoin,Anti-acne; Barrier repair; Hydrating,20,63000,3.8,41648,https://raw.githubusercontent.com/github/explore/main/topics/angular/angular.png?seed=skincare1505,"Moisturizer for all skin with Centella Asiatica, Allantoin to support anti-acne & barrier repair."
1506,Olay Pro Centella Asiatica Hydrating Toner,Olay,Toner,Oily,Centella Asiatica; Green Tea; Hyaluronic Acid,Barrier repair; Anti-acne,80,73000,4.3,31849,https://raw.githubusercontent.com/github/explore/main/topics/nodejs/nodejs.png?seed=skincare1506,"Toner for oily skin with Centella Asiatica, Green Tea to support barrier repair & anti-acne."
1507,Kiehl's Glow Peptide Firming Eye Cream,Kiehl's,Eye Cream,Oily,Peptide; Squalane,Hydrating; Pore care; Barrier repair,30,475000,3.6,29277,https://raw.githubusercontent.com/github/explore/main/topics/python/python.png?seed=skincare1507,"Eye Cream for oily skin with Peptide, Squalane to support hydrating & pore care."
1508,Wardah Ultra AHA/BHA Resurfacing Serum,Wardah,Exfoliator,All,AHA/BHA; Centella Asiatica; Hyaluronic Acid,Brightening; Oil control; Anti-aging,100,97000,4.3,5252,https://raw.githubusercontent.com/github/explore/main/topics/java/java.png?seed=skincare1508,"Exfoliator for all skin with AHA/BHA, Centella Asiatica to support brightening & oil control."
1509,Skintific Glow Hyaluronic Acid Peeling Solution,Skintific,Exfoliator,Oily,Hyaluronic Acid; Panthenol; Squalane,Anti-aging; Pore care; Anti-acne,100,143000,5.0,6596,https://raw.githubusercontent.com/github/explore/main/topics/go/go.png?seed=skincare1509,"Exfoliator for oily skin with Hyaluronic Acid, Panthenol to support anti-aging & pore care."
1510,Wardah Pure Retinol Facial Wash,Wardah,Cleanser,Oily,Retinol; Tranexamic Acid; Peptide,Pore care; Hydrating,50,87000,4.6,42391,https://raw.githubusercontent.com/github/explore/main/topics/ruby/ruby.png?seed=skincare1510,"Cleanser for oily skin with Retinol, Tranexamic Acid to support pore care & hydrating."
1511,Cetaphil Ultra Niacinamide Hydrating Essence,Cetaphil,Essence,Combination,Niacinamide; Salicylic Acid; Tranexamic Acid,Anti-acne; Anti-aging; Oil control,50,175000,4.6,2335,https://raw.githubusercontent.com/github/explore/main/topics/php/php.png?seed=skincare1511,"Essence for combination skin with Niacinamide, Salicylic Acid to support anti-acne & anti-aging."
1512,Erha Daily Squalane Foam Cleanser,Erha,Cleanser,Dry,Squalane; Niacinamide; Peptide; Allantoin,Brightening; Oil control,80,121000,3.9,24573,https://raw.githubusercontent.com/github/explore/main/topics/swift/swift.png?seed=skincare1512,"Cleanser for dry skin with Squalane, Niacinamide to support brightening & oil control."
1513,Innisfree Pure AHA/BHA Exfoliating Toner,Innisfree,Exfoliator,Sensitive,AHA/BHA; Retinol,Pore care; Barrier repair; Brightening,80,228000,3.7,23490,https://raw.githubusercontent.com/github/explore/main/topics/kotlin/kotlin.png?seed=skincare1513,"Exfoliator for sensitive skin with AHA/BHA, Retinol to support pore care & barrier repair."
1514,Nivea Ultra Retinol Face Oil,Nivea,Facial Oil,Oily,Retinol; Hyaluronic Acid; Ceramide,Oil control; Barrier repair; Anti-acne,30,136000,4.1,11825,https://raw.githubusercontent.com/github/explore/main/topics/docker/docker.png?seed=skincare1514,"Facial Oil for oily skin with Retinol, Hyaluronic Acid to support oil control & barrier repair."
1515,Safi Glow Centella Asiatica Cream Cleanser,Safi,Cleanser,All,Centella Asiatica; Niacinamide; AHA/BHA; Ceramide,Barrier repair; Hydrating; Oil control,200,215000,4.0,12892,https://raw.githubusercontent.com/github/explore/main/topics/kubernetes/kubernetes.png?seed=skincare1515,"Cleanser for all skin with Centella Asiatica, Niacinamide to support barrier repair & hydrating."
1516,Vaseline Calm Panthenol Hydrating Toner,Vaseline,Toner,Oily,Panthenol; Hyaluronic Acid; Retinol,Brightening; Anti-aging,150,224000,3.9,11445,https://raw.githubusercontent.com/github/explore/main/topics/aws/aws.png?seed=skincare1516,"Toner for oily skin with Panthenol, Hyaluronic Acid to support brightening & anti-aging."
1517,Garnier Advanced AHA/BHA Repair Oil,Garnier,Facial Oil,Oily,AHA/BHA; Salicylic Acid,Pore care; Anti-aging,40,117000,4.6,20221,https://raw.githubusercontent.com/github/explore/main/topics/azure/azure.png?seed=skincare1517,"Facial Oil for oily skin with AHA/BHA, Salicylic Acid to support pore care & anti-aging."
1518,Kiehl's Hydra Panthenol Soothing Toner,Kiehl's,Toner,Sensitive,Panthenol; Allantoin; Centella Asiatica; Hyaluronic Acid,Anti-aging; Hydrating; Soothing,200,153000,4.6,44003,https://raw.githubusercontent.com/github/explore/main/topics/linux/linux.png?seed=skincare1518,"Toner for sensitive skin with Panthenol, Allantoin to support anti-aging & hydrating."
1519,Clinique Hydra Tranexamic Acid Booster Serum,Clinique,Serum,Combination,Tranexamic Acid; Retinol,Brightening; Anti-aging; Soothing,50,514000,4.9,18962,https://raw.githubusercontent.com/github/explore/main/topics/mongodb/mongodb.png?seed=skincare1519,"Serum for combination skin with Tranexamic Acid, Retinol to support brightening & anti-aging."
1520,Skintific Advanced Centella Asiatica Daily Toner,Skintific,Toner,Sensitive,Centella Asiatica; Niacinamide; Panthenol,Anti-acne; Oil control,150,168000,4.6,5076,https://raw.githubusercontent.com/github/explore/main/topics/postgresql/postgresql.png?seed=skincare1520,"Toner for sensitive skin with Centella Asiatica, Niacinamide to support anti-acne & oil control."
1521,Cetaphil Daily AHA/BHA Peeling Solution,Cetaphil,Exfoliator,All,AHA/BHA; Peptide,Pore care; Barrier repair,50,388000,4.8,16799,https://raw.githubusercontent.com/github/explore/main/topics/javascript/javascript.png?seed=skincare1521,"Exfoliator for all skin with AHA/BHA, Peptide to support pore care & barrier repair."
1522,Cosrx Renew Green Tea Eye Treatment,Cosrx,Eye Cream,Combination,Green Tea; Ceramide,Anti-aging; Soothing; Oil control,30,430000,4.7,6208,https://raw.githubusercontent.com/github/explore/main/topics/react/react.png?seed=skincare1522,"Eye Cream for combination skin with Green Tea, Ceramide to support anti-aging & soothing."
1523,Olay Gentle Squalane Face Serum,Olay,Serum,All,Squalane; Ceramide,Anti-aging; Oil control,30,380000,4.4,43877,https://raw.githubusercontent.com/github/explore/main/topics/vue/vue.png?seed=skincare1523,"Serum for all skin with Squalane, Ceramide to support anti-aging & oil control."
1524,Innisfree Daily Allantoin Balancing Toner,Innisfree,Toner,Normal,Allantoin; Hyaluronic Acid; Squalane; Niacinamide,Soothing; Brightening,100,129000,4.4,43940,https://raw.githubusercontent.com/github/explore/main/topics/angular/angular.png?seed=skincare1524,"Toner for normal skin with Allantoin, Hyaluronic Acid to support soothing & brightening."
1525,Innisfree Pure Panthenol Gel Moisturizer,Innisfree,Moisturizer,Normal,Panthenol; Green Tea,Barrier repair; Anti-aging; Oil control,20,224000,4.4,19651,https://raw.githubusercontent.com/github/explore/main/topics/nodejs/nodejs.png?seed=skincare1525,"Moisturizer for normal skin with Panthenol, Green Tea to support barrier repair & anti-aging."
1526,Cetaphil Gentle Peptide Balancing Toner,Cetaphil,Toner,Normal,Peptide; Tranexamic Acid,Brightening; Anti-acne; Oil control,100,146000,3.8,36738,https://raw.githubusercontent.com/github/explore/main/topics/python/python.png?seed=skincare1526,"Toner for normal skin with Peptide, Tranexamic Acid to support brightening & anti-acne."
1527,Garnier Advanced Vitamin C Revive Eye Balm,Garnier,Eye Cream,Oily,Vitamin C; Niacinamide; Panthenol,Oil control; Hydrating; Pore care,20,197000,4.1,34392,https://raw.githubusercontent.com/github/explore/main/topics/java/java.png?seed=skincare1527,"Eye Cream for oily skin with Vitamin C, Niacinamide to support oil control & hydrating."
1528,Innisfree Calm Ceramide Skin Essence,Innisfree,Essence,Dry,Ceramide; Hyaluronic Acid; Vitamin C,Brightening; Barrier repair,50,209000,4.7,20337,https://raw.githubusercontent.com/github/explore/main/topics/go/go.png?seed=skincare1528,"Essence for dry skin with Ceramide, Hyaluronic Acid to support brightening & barrier repair."
1529,Cetaphil Glow Squalane Firming Eye Cream,Cetaphil,Eye Cream,Sensitive,Squalane; Vitamin C; Tranexamic Acid; Ceramide,Hydrating; Pore care,10,380000,4.1,46230,https://raw.githubusercontent.com/github/explore/main/topics/ruby/ruby.png?seed=skincare1529,"Eye Cream for sensitive skin with Squalane, Vitamin C to support hydrating & pore care."
1530,Skintific Hydra Niacinamide Face Serum,Skintific,Serum,Normal,Niacinamide; Tranexamic Acid; Vitamin C,Pore care; Barrier repair,15,301000,4.0,15097,https://raw.githubusercontent.com/github/explore/main/topics/php/php.png?seed=skincare1530,"Serum for normal skin with Niacinamide, Tranexamic Acid to support pore care & barrier repair."
1531,Safi Gentle Panthenol Sleeping Mask,Safi,Face Mask,Oily,Panthenol; Centella Asiatica,Hydrating; Anti-acne; Oil control,75,121000,4.9,10648,https://raw.githubusercontent.com/github/explore/main/topics/swift/swift.png?seed=skincare1531,"Face Mask for oily skin with Panthenol, Centella Asiatica to support hydrating & anti-acne."
1532,Neutrogena Gentle Retinol Revive Eye Balm,Neutrogena,Eye Cream,Normal,Retinol; Vitamin C; Squalane,Barrier repair; Hydrating,15,116000,4.8,49262,https://raw.githubusercontent.com/github/explore/main/topics/kotlin/kotlin.png?seed=skincare1532,"Eye Cream for normal skin with Retinol, Vitamin C to support barrier repair & hydrating."
1533,Safi Radiance Niacinamide Eye Treatment,Safi,Eye Cream,Normal,Niacinamide; Peptide; AHA/BHA; Hyaluronic Acid,Anti-aging; Barrier repair; Anti-acne,15,261000,4.9,43595,https://raw.githubusercontent.com/github/explore/main/topics/docker/docker.png?seed=skincare1533,"Eye Cream for normal skin with Niacinamide, Peptide to support anti-aging & barrier repair."
1534,Garnier Balance Ceramide Glow Oil,Garnier,Facial Oil,Oily,Ceramide; Tranexamic Acid,Barrier repair; Brightening; Hydrating,40,309000,4.3,11575,https://raw.githubusercontent.com/github/explore/main/topics/kubernetes/kubernetes.png?seed=skincare1534,"Facial Oil for oily skin with Ceramide, Tranexamic Acid to support barrier repair & brightening."
1535,Emina Calm Tranexamic Acid Skin Essence,Emina,Essence,Normal,Tranexamic Acid; Hyaluronic Acid; Green Tea,Barrier repair; Anti-acne; Anti-aging,80,151000,3.8,47012,https://raw.githubusercontent.com/github/explore/main/topics/aws/aws.png?seed=skincare1535,"Essence for normal skin with Tranexamic Acid, Hyaluronic Acid to support barrier repair & anti-acne."
1536,Wardah Pro Vitamin C Sleeping Mask,Wardah,Face Mask,Oily,Vitamin C; Green Tea,Hydrating; Pore care,30,47000,4.2,6368,https://raw.githubusercontent.com/github/explore/main/topics/azure/azure.png?seed=skincare1536,"Face Mask for oily skin with Vitamin C, Green Tea to support hydrating & pore care."
1537,Olay Glow Allantoin Sleeping Mask,Olay,Face Mask,Normal,Allantoin; Salicylic Acid,Pore care; Barrier repair; Oil control,80,226000,3.8,38402,https://raw.githubusercontent.com/github/explore/main/topics/linux/linux.png?seed=skincare1537,"Face Mask for normal skin with Allantoin, Salicylic Acid to support pore care & barrier repair."
1538,Safi Glow Peptide Glow Oil,Safi,Facial Oil,Oily,Peptide; Squalane; Centella Asiatica,Pore care; Hydrating; Soothing,30,475000,4.6,46166,https://raw.githubusercontent.com/github/explore/main/topics/mongodb/mongodb.png?seed=skincare1538,"Facial Oil for oily skin with Peptide, Squalane to support pore care & hydrating."
1539,Avoskin Calm Squalane Facial Wash,Avoskin,Cleanser,Dry,Squalane; Allantoin,Soothing; Brightening,80,147000,4.8,29113,https://raw.githubusercontent.com/github/explore/main/topics/postgresql/postgresql.png?seed=skincare1539,"Cleanser for dry skin with Squalane, Allantoin to support soothing & brightening."
1540,Kiehl's Calm Green Tea Eye Treatment,Kiehl's,Eye Cream,Normal,Green Tea; Centella Asiatica; Allantoin; AHA/BHA,Anti-acne; Anti-aging; Pore care,10,108000,3.8,36431,https://raw.githubusercontent.com/github/explore/main/topics/javascript/javascript.png?seed=skincare1540,"Eye Cream for normal skin with Green Tea, Centella Asiatica to support anti-acne & anti-aging."
1541,Olay Ultra Salicylic Acid Hydro Mask,Olay,Face Mask,Dry,Salicylic Acid; Squalane; Peptide,Anti-aging; Anti-acne; Hydrating,75,52000,4.3,46478,https://raw.githubusercontent.com/github/explore/main/topics/react/react.png?seed=skincare1541,"Face Mask for dry skin with Salicylic Acid, Squalane to support anti-aging & anti-acne."
1542,Emina Balance Niacinamide Bright Eye Cream,Emina,Eye Cream,Sensitive,Niacinamide; AHA/BHA; Ceramide,Hydrating; Barrier repair,20,324000,4.8,4051,https://raw.githubusercontent.com/github/explore/main/topics/vue/vue.png?seed=skincare1542,"Eye Cream for sensitive skin with Niacinamide, AHA/BHA to support hydrating & barrier repair."
1543,L'Oreal Paris Glow Squalane Brightening Essence,L'Oreal Paris,Essence,Oily,Squalane; Hyaluronic Acid,Pore care; Soothing,80,264000,4.3,2915,https://raw.githubusercontent.com/github/explore/main/topics/angular/angular.png?seed=skincare1543,"Essence for oily skin with Squalane, Hyaluronic Acid to support pore care & soothing."
1544,Pyunkang Yul Gentle Green Tea Hydrating Toner,Pyunkang Yul,Toner,Sensitive,Green Tea; Panthenol; Niacinamide,Anti-aging; Barrier repair,200,189000,4.8,46956,https://raw.githubusercontent.com/github/explore/main/topics/nodejs/nodejs.png?seed=skincare1544,"Toner for sensitive skin with Green Tea, Panthenol to support anti-aging & barrier repair."
1545,Neutrogena Pro Centella Asiatica Nourishing Oil,Neutrogena,Facial Oil,Sensitive,Centella Asiatica; Green Tea; Squalane,Oil control; Soothing; Hydrating,15,299000,4.9,44179,https://raw.githubusercontent.com/github/explore/main/topics/python/python.png?seed=skincare1545,"Facial Oil for sensitive skin with Centella Asiatica, Green Tea to support oil control & soothing."
1546,Somethinc Glow Ceramide Hydrating Toner,Somethinc,Toner,Oily,Ceramide; Peptide,Barrier repair; Anti-acne; Soothing,120,199000,4.0,25021,https://raw.githubusercontent.com/github/explore/main/topics/java/java.png?seed=skincare1546,"Toner for oily skin with Ceramide, Peptide to support barrier repair & anti-acne."
1547,Avoskin Advanced Peptide Face Serum,Avoskin,Serum,Combination,Peptide; Centella Asiatica; Green Tea; Panthenol,Anti-acne; Hydrating; Barrier repair,20,83000,4.4,34633,https://raw.githubusercontent.com/github/explore/main/topics/go/go.png?seed=skincare1547,"Serum for combination skin with Peptide, Centella Asiatica to support anti-acne & hydrating."
1548,Neutrogena Calm Centella Asiatica Hydrating Essence,Neutrogena,Essence,Dry,Centella Asiatica; AHA/BHA,Anti-aging; Brightening,80,102000,4.5,20285,https://raw.githubusercontent.com/github/explore/main/topics/ruby/ruby.png?seed=skincare1548,"Essence for dry skin with Centella Asiatica, AHA/BHA to support anti-aging & brightening."
1549,Safi Advanced Allantoin Bright Eye Cream,Safi,Eye Cream,Dry,Allantoin; Green Tea,Barrier repair; Pore care; Soothing,10,156000,4.7,7588,https://raw.githubusercontent.com/github/explore/main/topics/php/php.png?seed=skincare1549,"Eye Cream for dry skin with Allantoin, Green Tea to support barrier repair & pore care."
1550,CeraVe Ultra Vitamin C Repair Essence,CeraVe,Essence,Sensitive,Vitamin C; Panthenol,Soothing; Brightening; Anti-aging,60,420000,4.4,35022,https://raw.githubusercontent.com/github/explore/main/topics/swift/swift.png?seed=skincare1550,"Essence for sensitive skin with Vitamin C, Panthenol to support soothing & brightening."
1551,Vaseline Hydra Hyaluronic Acid Daily Toner,Vaseline,Toner,Combination,Hyaluronic Acid; Centella Asiatica; Allantoin; Tranexamic Acid,Pore care; Brightening; Barrier repair,80,198000,4.4,13718,https://raw.githubusercontent.com/github/explore/main/topics/kotlin/kotlin.png?seed=skincare1551,"Toner for combination skin with Hyaluronic Acid, Centella Asiatica to support pore care & brightening."
1552,Innisfree Pro Green Tea Bright Eye Cream,Innisfree,Eye Cream,Sensitive,Green Tea; Salicylic Acid; Ceramide,Anti-aging; Hydrating,15,253000,4.2,7751,https://raw.githubusercontent.com/github/explore/main/topics/docker/docker.png?seed=skincare1552,"Eye Cream for sensitive skin with Green Tea, Salicylic Acid to support anti-aging & hydrating."
1553,Hada Labo Calm Panthenol Firming Eye Cream,Hada Labo,Eye Cream,Oily,Panthenol; AHA/BHA,Barrier repair; Hydrating,25,165000,4.6,35134,https://raw.githubusercontent.com/github/explore/main/topics/kubernetes/kubernetes.png?seed=skincare1553,"Eye Cream for oily skin with Panthenol, AHA/BHA to support barrier repair & hydrating."
1554,CeraVe Ultra Retinol Repair Essence,CeraVe,Essence,Combination,Retinol; Allantoin; Hyaluronic Acid; Panthenol,Anti-aging; Anti-acne; Hydrating,80,316000,3.8,30946,https://raw.githubusercontent.com/github/explore/main/topics/aws/aws.png?seed=skincare1554,"Essence for combination skin with Retinol, Allantoin to support anti-aging & anti-acne."
1555,Vaseline Calm Centella Asiatica Eye Treatment,Vaseline,Eye Cream,Oily,Centella Asiatica; Allantoin; AHA/BHA,Barrier repair; Hydrating,10,150000,4.4,6327,https://raw.githubusercontent.com/github/explore/main/topics/azure/azure.png?seed=skincare1555,"Eye Cream for oily skin with Centella Asiatica, Allantoin to support barrier repair & hydrating."
1556,Avoskin Advanced Panthenol Concentrate Serum,Avoskin,Serum,All,Panthenol; Retinol; Peptide; Allantoin,Soothing; Brightening,40,121000,3.6,1566,https://raw.githubusercontent.com/github/explore/main/topics/linux/linux.png?seed=skincare1556,"Serum for all skin with Panthenol, Retinol to support soothing & brightening."
1557,Wardah Daily Retinol Brightening Essence,Wardah,Essence,Oily,Retinol; Squalane; Peptide; Hyaluronic Acid,Barrier repair; Pore care,30,172000,3.8,41220,https://raw.githubusercontent.com/github/explore/main/topics/mongodb/mongodb.png?seed=skincare1557,"Essence for oily skin with Retinol, Squalane to support barrier repair & pore care."
1558,Azarine Hydra Allantoin Soothing Toner,Azarine,Toner,Oily,Allantoin; Hyaluronic Acid,Anti-acne; Anti-aging,100,190000,4.3,15487,https://raw.githubusercontent.com/github/explore/main/topics/postgresql/postgresql.png?seed=skincare1558,"Toner for oily skin with Allantoin, Hyaluronic Acid to support anti-acne & anti-aging."
1559,Erha Advanced Panthenol Glow Oil,Erha,Facial Oil,Oily,Panthenol; AHA/BHA,Brightening; Anti-aging,40,153000,4.3,26570,https://raw.githubusercontent.com/github/explore/main/topics/javascript/javascript.png?seed=skincare1559,"Facial Oil for oily skin with Panthenol, AHA/BHA to support brightening & anti-aging."
1560,Skintific Gentle Peptide Clay Mask,Skintific,Face Mask,Oily,Peptide; Vitamin C,Oil control; Hydrating; Pore care,50,197000,4.4,32054,https://raw.githubusercontent.com/github/explore/main/topics/react/react.png?seed=skincare1560,"Face Mask for oily skin with Peptide, Vitamin C to support oil control & hydrating."
1561,Vaseline Renew AHA/BHA Skin Essence,Vaseline,Essence,Combination,AHA/BHA; Allantoin; Tranexamic Acid; Hyaluronic Acid,Oil control; Pore care,80,170000,4.2,40043,https://raw.githubusercontent.com/github/explore/main/topics/vue/vue.png?seed=skincare1561,"Essence for combination skin with AHA/BHA, Allantoin to support oil control & pore care."
1562,Nivea Ultra Allantoin Skin Essence,Nivea,Essence,All,Allantoin; Salicylic Acid,Brightening; Anti-acne; Oil control,60,208000,4.2,27859,https://raw.githubusercontent.com/github/explore/main/topics/angular/angular.png?seed=skincare1562,"Essence for all skin with Allantoin, Salicylic Acid to support brightening & anti-acne."
1563,Bioaqua Glow Vitamin C Treatment Serum,Bioaqua,Serum,Normal,Vitamin C; Niacinamide; Retinol; Hyaluronic Acid,Anti-aging; Hydrating; Oil control,40,341000,3.8,45642,https://raw.githubusercontent.com/github/explore/main/topics/nodejs/nodejs.png?seed=skincare1563,"Serum for normal skin with Vitamin C, Niacinamide to support anti-aging & hydrating."
1564,Hada Labo Daily Panthenol Barrier Cream,Hada Labo,Moisturizer,Dry,Panthenol; Salicylic Acid; Green Tea; Tranexamic Acid,Oil control; Soothing; Brightening,20,346000,4.3,34592,https://raw.githubusercontent.com/github/explore/main/topics/python/python.png?seed=skincare1564,"Moisturizer for dry skin with Panthenol, Salicylic Acid to support oil control & soothing."
1565,Cosrx Calm Hyaluronic Acid Cream Cleanser,Cosrx,Cleanser,Sensitive,Hyaluronic Acid; Vitamin C,Anti-aging; Barrier repair,150,108000,4.8,12322,https://raw.githubusercontent.com/github/explore/main/topics/java/java.png?seed=skincare1565,"Cleanser for sensitive skin with Hyaluronic Acid, Vitamin C to support anti-aging & barrier repair."
1566,Olay Ultra Peptide Bright Eye Cream,Olay,Eye Cream,Sensitive,Peptide; Panthenol; Ceramide; Centella Asiatica,Anti-aging; Pore care,15,359000,4.8,5545,https://raw.githubusercontent.com/github/explore/main/topics/go/go.png?seed=skincare1566,"Eye Cream for sensitive skin with Peptide, Panthenol to support anti-aging & pore care."
1567,Emina Radiance Niacinamide Face Oil,Emina,Facial Oil,Normal,Niacinamide; Panthenol,Pore care; Oil control; Anti-aging,30,422000,4.4,48917,https://raw.githubusercontent.com/github/explore/main/topics/ruby/ruby.png?seed=skincare1567,"Facial Oil for normal skin with Niacinamide, Panthenol to support pore care & oil control."
1568,CeraVe Balance Retinol Barrier Cream,CeraVe,Moisturizer,Sensitive,Retinol; Vitamin C,Barrier repair; Brightening,60,483000,4.0,25485,https://raw.githubusercontent.com/github/explore/main/topics/php/php.png?seed=skincare1568,"Moisturizer for sensitive skin with Retinol, Vitamin C to support barrier repair & brightening."
1569,Garnier Renew Vitamin C Soothing Toner,Garnier,Toner,All,Vitamin C; Green Tea; Allantoin,Oil control; Soothing; Anti-acne,60,187000,4.4,25832,https://raw.githubusercontent.com/github/explore/main/topics/swift/swift.png?seed=skincare1569,"Toner for all skin with Vitamin C, Green Tea to support oil control & soothing."
1570,Vaseline Calm Centella Asiatica Facial Wash,Vaseline,Cleanser,Normal,Centella Asiatica; Hyaluronic Acid; AHA/BHA; Niacinamide,Soothing; Anti-aging,50,182000,4.9,18180,https://raw.githubusercontent.com/github/explore/main/topics/kotlin/kotlin.png?seed=skincare1570,"Cleanser for normal skin with Centella Asiatica, Hyaluronic Acid to support soothing & anti-aging."
