id,product_name,brand,category,skin_type,key_ingredients,benefits,size_ml,price_idr,rating,review_count,image_url,description
454,Erha Balance AHA/BHA Gel Cleanser,Erha,Cleanser,Dry,AHA/BHA; Hyaluronic Acid; Panthenol; Allantoin,Oil control; Anti-aging; Barrier repair,150,150000,4.6,6209,https://raw.githubusercontent.com/github/explore/main/topics/linux/linux.png?seed=skincare454,"Cleanser for dry skin with AHA/BHA, Hyaluronic Acid to support oil control & anti-aging."
455,Clinique Radiance Salicylic Acid Repair Essence,Clinique,Essence,Normal,Salicylic Acid; Centella Asiatica; Vitamin C,Hydrating; Soothing,100,411000,3.9,19659,https://raw.githubusercontent.com/github/explore/main/topics/mongodb/mongodb.png?seed=skincare455,"Essence for normal skin with Salicylic Acid, Centella Asiatica to support hydrating & soothing."
456,La Roche-Posay Ultra Retinol Peeling Solution,La Roche-Posay,Exfoliator,All,Retinol; Ceramide,Pore care; Oil control; Brightening,20,81000,4.2,6601,https://raw.githubusercontent.com/github/explore/main/topics/postgresql/postgresql.png?seed=skincare456,"Exfoliator for all skin with Retinol, Ceramide to support pore care & oil control."
457,The Ordinary Daily Salicylic Acid Eye Treatment,The Ordinary,Eye Cream,Sensitive,Salicylic Acid; Peptide; Allantoin,Brightening; Oil control,30,185000,3.8,29304,https://raw.githubusercontent.com/github/explore/main/topics/javascript/javascript.png?seed=skincare457,"Eye Cream for sensitive skin with Salicylic Acid, Peptide to support brightening & oil control."
458,Clinique Calm Allantoin Sun Protector,Clinique,Sunscreen,All,Allantoin; Panthenol; Retinol,Anti-aging; Anti-acne,35,249000,4.7,42576,https://raw.githubusercontent.com/github/explore/main/topics/react/react.png?seed=skincare458,"Sunscreen for all skin with Allantoin, Panthenol to support anti-aging & anti-acne."
459,Vaseline Daily AHA/BHA Bright Eye Cream,Vaseline,Eye Cream,Sensitive,AHA/BHA; Panthenol; Ceramide,Anti-acne; Barrier repair; Brightening,20,427000,4.3,12132,https://raw.githubusercontent.com/github/explore/main/topics/vue/vue.png?seed=skincare459,"Eye Cream for sensitive skin with AHA/BHA, Panthenol to support anti-acne & barrier repair."
460,CeraVe Radiance Vitamin C Gel Cleanser,CeraVe,Cleanser,Normal,Vitamin C; Peptide; Tranexamic Acid,Anti-aging; Soothing,80,219000,4.6,18766,https://raw.githubusercontent.com/github/explore/main/topics/angular/angular.png?seed=skincare460,"Cleanser for normal skin with Vitamin C, Peptide to support anti-aging & soothing."
461,Kiehl's Pure Panthenol Firming Eye Cream,Kiehl's,Eye Cream,All,Panthenol; Centella Asiatica,Barrier repair; Brightening; Anti-aging,20,120000,4.1,11438,https://raw.githubusercontent.com/github/explore/main/topics/nodejs/nodejs.png?seed=skincare461,"Eye Cream for all skin with Panthenol, Centella Asiatica to support barrier repair & brightening."
462,L'Oreal Paris Pure Centella Asiatica Gel Moisturizer,L'Oreal Paris,Moisturizer,Dry,Centella Asiatica; Salicylic Acid,Brightening; Barrier repair; Hydrating,60,340000,4.3,929,https://raw.githubusercontent.com/github/explore/main/topics/python/python.png?seed=skincare462,"Moisturizer for dry skin with Centella Asiatica, Salicylic Acid to support brightening & barrier repair."
463,Cosrx Gentle Centella Asiatica Foam Cleanser,Cosrx,Cleanser,All,Centella Asiatica; Peptide; Allantoin; Niacinamide,Brightening; Oil control,150,82000,4.7,31667,https://raw.githubusercontent.com/github/explore/main/topics/java/java.png?seed=skincare463,"Cleanser for all skin with Centella Asiatica, Peptide to support brightening & oil control."
464,Olay Calm Peptide UV Shield,Olay,Sunscreen,Oily,Peptide; Retinol,Brightening; Soothing; Oil control,50,51000,4.9,4596,https://raw.githubusercontent.com/github/explore/main/topics/go/go.png?seed=skincare464,"Sunscreen for oily skin with Peptide, Retinol to support brightening & soothing."
465,Bioderma Daily Vitamin C Cream Cleanser,Bioderma,Cleanser,Combination,Vitamin C; Allantoin; Peptide,Oil control; Soothing; Anti-acne,50,154000,4.8,8339,https://raw.githubusercontent.com/github/explore/main/topics/ruby/ruby.png?seed=skincare465,"Cleanser for combination skin with Vitamin C, Allantoin to support oil control & soothing."
466,Nivea Advanced Green Tea Exfoliating Toner,Nivea,Exfoliator,Sensitive,Green Tea; Allantoin; Squalane; Peptide,Hydrating; Pore care; Soothing,50,391000,4.7,27266,https://raw.githubusercontent.com/github/explore/main/topics/php/php.png?seed=skincare466,"Exfoliator for sensitive skin with Green Tea, Allantoin to support hydrating & pore care."
467,Azarine Hydra Allantoin Peeling Solution,Azarine,Exfoliator,Normal,Allantoin; Hyaluronic Acid; Niacinamide; Green Tea,Anti-acne; Anti-aging,20,410000,4.9,29324,https://raw.githubusercontent.com/github/explore/main/topics/swift/swift.png?seed=skincare467,"Exfoliator for normal skin with Allantoin, Hyaluronic Acid to support anti-acne & anti-aging."
468,Wardah Renew Ceramide Daily Toner,Wardah,Toner,Oily,Ceramide; Niacinamide,Oil control; Hydrating; Brightening,150,240000,4.1,20691,https://raw.githubusercontent.com/github/explore/main/topics/kotlin/kotlin.png?seed=skincare468,"Toner for oily skin with Ceramide, Niacinamide to support oil control & hydrating."
469,Cetaphil Hydra Ceramide Sun Protector,Cetaphil,Sunscreen,Normal,Ceramide; Panthenol,Hydrating; Barrier repair; Brightening,35,153000,3.7,200,https://raw.githubusercontent.com/github/explore/main/topics/docker/docker.png?seed=skincare469,"Sunscreen for normal skin with Ceramide, Panthenol to support hydrating & barrier repair."
470,La Roche-Posay Pro Squalane Revive Eye Balm,La Roche-Posay,Eye Cream,Sensitive,Squalane; Tranexamic Acid,Oil control; Barrier repair,10,495000,4.5,33243,https://raw.githubusercontent.com/github/explore/main/topics/kubernetes/kubernetes.png?seed=skincare470,"Eye Cream for sensitive skin with Squalane, Tranexamic Acid to support oil control & barrier repair."
471,Scarlett Hydra Hyaluronic Acid Face Oil,Scarlett,Facial Oil,Sensitive,Hyaluronic Acid; Tranexamic Acid; Salicylic Acid; Squalane,Anti-aging; Brightening,30,360000,5.0,25438,https://raw.githubusercontent.com/github/explore/main/topics/aws/aws.png?seed=skincare471,"Facial Oil for sensitive skin with Hyaluronic Acid, Tranexamic Acid to support anti-aging & brightening."
472,Wardah Pro Centella Asiatica Gel Cleanser,Wardah,Cleanser,Oily,Centella Asiatica; Squalane,Oil control; Hydrating,120,74000,4.4,7893,https://raw.githubusercontent.com/github/explore/main/topics/azure/azure.png?seed=skincare472,"Cleanser for oily skin with Centella Asiatica, Squalane to support oil control & hydrating."
473,L'Oreal Paris Advanced Tranexamic Acid Soothing Mask,L'Oreal Paris,Face Mask,Dry,Tranexamic Acid; Centella Asiatica; Niacinamide; Allantoin,Anti-aging; Oil control,80,211000,4.2,16337,https://raw.githubusercontent.com/github/explore/main/topics/linux/linux.png?seed=skincare473,"Face Mask for dry skin with Tranexamic Acid, Centella Asiatica to support anti-aging & oil control."
474,Innisfree Pure Vitamin C Brightening Essence,Innisfree,Essence,Dry,Vitamin C; Green Tea,Brightening; Hydrating; Anti-acne,120,251000,3.9,32102,https://raw.githubusercontent.com/github/explore/main/topics/mongodb/mongodb.png?seed=skincare474,"Essence for dry skin with Vitamin C, Green Tea to support brightening & hydrating."
475,Cetaphil Pro AHA/BHA Repair Oil,Cetaphil,Facial Oil,Dry,AHA/BHA; Tranexamic Acid; Squalane,Anti-aging; Soothing,50,415000,4.1,17697,https://raw.githubusercontent.com/github/explore/main/topics/postgresql/postgresql.png?seed=skincare475,"Facial Oil for dry skin with AHA/BHA, Tranexamic Acid to support anti-aging & soothing."
476,Innisfree Radiance Panthenol Facial Wash,Innisfree,Cleanser,Normal,Panthenol; Squalane; Ceramide; Salicylic Acid,Oil control; Barrier repair; Anti-aging,100,168000,4.0,32421,https://raw.githubusercontent.com/github/explore/main/topics/javascript/javascript.png?seed=skincare476,"Cleanser for normal skin with Panthenol, Squalane to support oil control & barrier repair."
477,Neutrogena Advanced Centella Asiatica Gel Cleanser,Neutrogena,Cleanser,All,Centella Asiatica; Allantoin; Tranexamic Acid; Panthenol,Oil control; Anti-aging,200,102000,4.6,12356,https://raw.githubusercontent.com/github/explore/main/topics/react/react.png?seed=skincare477,"Cleanser for all skin with Centella Asiatica, Allantoin to support oil control & anti-aging."
478,Nivea Pure Hyaluronic Acid Hydrating Essence,Nivea,Essence,Dry,Hyaluronic Acid; Allantoin; Ceramide; AHA/BHA,Pore care; Brightening; Hydrating,50,313000,4.7,16845,https://raw.githubusercontent.com/github/explore/main/topics/vue/vue.png?seed=skincare478,"Essence for dry skin with Hyaluronic Acid, Allantoin to support pore care & brightening."
479,Clinique Hydra Centella Asiatica Gel Cleanser,Clinique,Cleanser,Oily,Centella Asiatica; Squalane; Ceramide,Pore care; Anti-acne; Hydrating,200,259000,4.8,21721,https://raw.githubusercontent.com/github/explore/main/topics/angular/angular.png?seed=skincare479,"Cleanser for oily skin with Centella Asiatica, Squalane to support pore care & anti-acne."
480,Scarlett Daily Retinol Balancing Toner,Scarlett,Toner,Oily,Retinol; Salicylic Acid; Peptide; Ceramide,Barrier repair; Anti-aging; Hydrating,200,133000,4.0,34054,https://raw.githubusercontent.com/github/explore/main/topics/nodejs/nodejs.png?seed=skincare480,"Toner for oily skin with Retinol, Salicylic Acid to support barrier repair & anti-aging."
481,Hada Labo Daily Green Tea Resurfacing Serum,Hada Labo,Exfoliator,Oily,Green Tea; Retinol,Soothing; Anti-aging; Pore care,30,410000,4.9,46924,https://raw.githubusercontent.com/github/explore/main/topics/python/python.png?seed=skincare481,"Exfoliator for oily skin with Green Tea, Retinol to support soothing & anti-aging."
482,CeraVe Pro AHA/BHA Sun Fluid,CeraVe,Sunscreen,All,AHA/BHA; Salicylic Acid; Green Tea,Barrier repair; Anti-acne; Pore care,50,310000,4.6,22978,https://raw.githubusercontent.com/github/explore/main/topics/java/java.png?seed=skincare482,"Sunscreen for all skin with AHA/BHA, Salicylic Acid to support barrier repair & anti-acne."
483,Cetaphil Ultra Allantoin Revive Eye Balm,Cetaphil,Eye Cream,Normal,Allantoin; Niacinamide; Green Tea; Panthenol,Anti-acne; Brightening; Anti-aging,20,254000,3.9,6833,https://raw.githubusercontent.com/github/explore/main/topics/go/go.png?seed=skincare483,"Eye Cream for normal skin with Allantoin, Niacinamide to support anti-acne & brightening."
484,Cetaphil Advanced Hyaluronic Acid Gentle Exfoliator,Cetaphil,Exfoliator,Combination,Hyaluronic Acid; Niacinamide; Retinol; Peptide,Pore care; Anti-acne,50,87000,4.3,24084,https://raw.githubusercontent.com/github/explore/main/topics/ruby/ruby.png?seed=skincare484,"Exfoliator for combination skin with Hyaluronic Acid, Niacinamide to support pore care & anti-acne."
485,Vaseline Balance Panthenol Daily Toner,Vaseline,Toner,Combination,Panthenol; Ceramide; Green Tea,Hydrating; Soothing; Brightening,80,135000,4.1,16995,https://raw.githubusercontent.com/github/explore/main/topics/php/php.png?seed=skincare485,"Toner for combination skin with Panthenol, Ceramide to support hydrating & soothing."
486,Cetaphil Ultra Niacinamide Hydrating Toner,Cetaphil,Toner,Normal,Niacinamide; AHA/BHA; Vitamin C; Salicylic Acid,Oil control; Anti-aging,60,222000,3.6,33877,https://raw.githubusercontent.com/github/explore/main/topics/swift/swift.png?seed=skincare486,"Toner for normal skin with Niacinamide, AHA/BHA to support oil control & anti-aging."
487,Wardah Pro Squalane Concentrate Serum,Wardah,Serum,Dry,Squalane; Niacinamide,Oil control; Hydrating; Brightening,40,157000,3.8,33942,https://raw.githubusercontent.com/github/explore/main/topics/kotlin/kotlin.png?seed=skincare487,"Serum for dry skin with Squalane, Niacinamide to support oil control & hydrating."
488,Bioaqua Renew Allantoin Gel Moisturizer,Bioaqua,Moisturizer,All,Allantoin; Niacinamide; Green Tea; Centella Asiatica,Brightening; Anti-acne,60,118000,4.7,47105,https://raw.githubusercontent.com/github/explore/main/topics/docker/docker.png?seed=skincare488,"Moisturizer for all skin with Allantoin, Niacinamide to support brightening & anti-acne."
489,Neutrogena Balance Vitamin C Resurfacing Serum,Neutrogena,Exfoliator,Dry,Vitamin C; Hyaluronic Acid,Pore care; Brightening; Oil control,60,122000,4.3,44936,https://raw.githubusercontent.com/github/explore/main/topics/kubernetes/kubernetes.png?seed=skincare489,"Exfoliator for dry skin with Vitamin C, Hyaluronic Acid to support pore care & brightening."
490,Wardah Daily Allantoin Moisturizing Cream,Wardah,Moisturizer,Combination,Allantoin; Peptide; Centella Asiatica; Tranexamic Acid,Barrier repair; Pore care,30,110000,4.1,42148,https://raw.githubusercontent.com/github/explore/main/topics/aws/aws.png?seed=skincare490,"Moisturizer for combination skin with Allantoin, Peptide to support barrier repair & pore care."
491,Pyunkang Yul Balance Niacinamide Cream Cleanser,Pyunkang Yul,Cleanser,Sensitive,Niacinamide; Retinol,Pore care; Oil control,120,98000,4.1,26843,https://raw.githubusercontent.com/github/explore/main/topics/azure/azure.png?seed=skincare491,"Cleanser for sensitive skin with Niacinamide, Retinol to support pore care & oil control."
492,Erha Radiance Retinol Hydro Mask,Erha,Face Mask,Oily,Retinol; Salicylic Acid,Oil control; Barrier repair; Anti-aging,50,35000,3.9,49881,https://raw.githubusercontent.com/github/explore/main/topics/linux/linux.png?seed=skincare492,"Face Mask for oily skin with Retinol, Salicylic Acid to support oil control & barrier repair."
493,Bioderma Daily AHA/BHA Balancing Toner,Bioderma,Toner,Sensitive,AHA/BHA; Allantoin,Hydrating; Soothing,150,199000,3.6,37428,https://raw.githubusercontent.com/github/explore/main/topics/mongodb/mongodb.png?seed=skincare493,"Toner for sensitive skin with AHA/BHA, Allantoin to support hydrating & soothing."
494,Elsheskin Hydra Allantoin Glow Oil,Elsheskin,Facial Oil,Oily,Allantoin; Tranexamic Acid,Barrier repair; Brightening,50,306000,4.8,4473,https://raw.githubusercontent.com/github/explore/main/topics/postgresql/postgresql.png?seed=skincare494,"Facial Oil for oily skin with Allantoin, Tranexamic Acid to support barrier repair & brightening."
495,Bioaqua Gentle Tranexamic Acid Hydrating Toner,Bioaqua,Toner,Oily,Tranexamic Acid; Squalane; Vitamin C,Anti-acne; Soothing,120,123000,4.4,41790,https://raw.githubusercontent.com/github/explore/main/topics/javascript/javascript.png?seed=skincare495,"Toner for oily skin with Tranexamic Acid, Squalane to support anti-acne & soothing."
496,Vaseline Ultra Vitamin C Gel Cleanser,Vaseline,Cleanser,All,Vitamin C; Panthenol; Green Tea,Soothing; Hydrating; Anti-acne,100,213000,4.8,23002,https://raw.githubusercontent.com/github/explore/main/topics/react/react.png?seed=skincare496,"Cleanser for all skin with Vitamin C, Panthenol to support soothing & hydrating."
497,Olay Pure Retinol Sunscreen Gel,Olay,Sunscreen,All,Retinol; Niacinamide,Anti-acne; Hydrating; Barrier repair,35,293000,4.4,40125,https://raw.githubusercontent.com/github/explore/main/topics/vue/vue.png?seed=skincare497,"Sunscreen for all skin with Retinol, Niacinamide to support anti-acne & hydrating."
498,Vaseline Balance Hyaluronic Acid Sun Fluid,Vaseline,Sunscreen,Normal,Hyaluronic Acid; Peptide; AHA/BHA,Soothing; Anti-acne; Anti-aging,70,97000,4.7,6515,https://raw.githubusercontent.com/github/explore/main/topics/angular/angular.png?seed=skincare498,"Sunscreen for normal skin with Hyaluronic Acid, Peptide to support soothing & anti-acne."
499,Emina Calm Allantoin Soothing Mask,Emina,Face Mask,Normal,Allantoin; AHA/BHA,Pore care; Barrier repair,120,184000,4.2,19655,https://raw.githubusercontent.com/github/explore/main/topics/nodejs/nodejs.png?seed=skincare499,"Face Mask for normal skin with Allantoin, AHA/BHA to support pore care & barrier repair."
500,Cetaphil Balance Salicylic Acid Brightening Essence,Cetaphil,Essence,Sensitive,Salicylic Acid; Vitamin C; Tranexamic Acid,Anti-aging; Hydrating,120,193000,4.1,36645,https://raw.githubusercontent.com/github/explore/main/topics/python/python.png?seed=skincare500,"Essence for sensitive skin with Salicylic Acid, Vitamin C to support anti-aging & hydrating."
501,CeraVe Daily Tranexamic Acid Nourishing Oil,CeraVe,Facial Oil,Dry,Tranexamic Acid; Niacinamide; Hyaluronic Acid,Brightening; Pore care; Barrier repair,40,381000,4.9,5787,https://raw.githubusercontent.com/github/explore/main/topics/java/java.png?seed=skincare501,"Facial Oil for dry skin with Tranexamic Acid, Niacinamide to support brightening & pore care."
502,Innisfree Hydra Centella Asiatica Clay Mask,Innisfree,Face Mask,Oily,Centella Asiatica; Peptide; Allantoin,Oil control; Soothing; Pore care,80,32000,3.7,13721,https://raw.githubusercontent.com/github/explore/main/topics/go/go.png?seed=skincare502,"Face Mask for oily skin with Centella Asiatica, Peptide to support oil control & soothing."
503,Bioaqua Daily Retinol Moisturizing Cream,Bioaqua,Moisturizer,All,Retinol; Hyaluronic Acid,Hydrating; Soothing,20,211000,4.6,28938,https://raw.githubusercontent.com/github/explore/main/topics/ruby/ruby.png?seed=skincare503,"Moisturizer for all skin with Retinol, Hyaluronic Acid to support hydrating & soothing."
504,La Roche-Posay Renew Salicylic Acid Soothing Mask,La Roche-Posay,Face Mask,Oily,Salicylic Acid; Panthenol; Allantoin; Ceramide,Brightening; Hydrating,100,166000,4.0,31483,https://raw.githubusercontent.com/github/explore/main/topics/php/php.png?seed=skincare504,"Face Mask for oily skin with Salicylic Acid, Panthenol to support brightening & hydrating."
505,Pyunkang Yul Renew Squalane Soothing Toner,Pyunkang Yul,Toner,Sensitive,Squalane; Panthenol; Vitamin C; Green Tea,Brightening; Pore care; Hydrating,80,232000,4.6,18364,https://raw.githubusercontent.com/github/explore/main/topics/swift/swift.png?seed=skincare505,"Toner for sensitive skin with Squalane, Panthenol to support brightening & pore care."
506,Olay Gentle Ceramide Firming Eye Cream,Olay,Eye Cream,All,Ceramide; Panthenol; Green Tea,Barrier repair; Pore care; Anti-aging,15,172000,3.7,22697,https://raw.githubusercontent.com/github/explore/main/topics/kotlin/kotlin.png?seed=skincare506,"Eye Cream for all skin with Ceramide, Panthenol to support barrier repair & pore care."
507,Erha Ultra Retinol Barrier Cream,Erha,Moisturizer,All,Retinol; Hyaluronic Acid; Tranexamic Acid,Hydrating; Pore care,20,178000,3.9,42229,https://raw.githubusercontent.com/github/explore/main/topics/docker/docker.png?seed=skincare507,"Moisturizer for all skin with Retinol, Hyaluronic Acid to support hydrating & pore care."
508,Somethinc Ultra Panthenol Sleeping Mask,Somethinc,Face Mask,Oily,Panthenol; Tranexamic Acid; Green Tea; Niacinamide,Pore care; Barrier repair; Brightening,120,195000,4.4,8284,https://raw.githubusercontent.com/github/explore/main/topics/kubernetes/kubernetes.png?seed=skincare508,"Face Mask for oily skin with Panthenol, Tranexamic Acid to support pore care & barrier repair."
509,Cosrx Ultra Vitamin C Concentrate Serum,Cosrx,Serum,Normal,Vitamin C; Tranexamic Acid; Ceramide; Squalane,Anti-acne; Soothing,20,167000,4.7,9156,https://raw.githubusercontent.com/github/explore/main/topics/aws/aws.png?seed=skincare509,"Serum for normal skin with Vitamin C, Tranexamic Acid to support anti-acne & soothing."
510,Safi Glow Centella Asiatica Balancing Toner,Safi,Toner,Sensitive,Centella Asiatica; Niacinamide; AHA/BHA; Tranexamic Acid,Hydrating; Brightening,200,156000,3.9,9230,https://raw.githubusercontent.com/github/explore/main/topics/azure/azure.png?seed=skincare510,"Toner for sensitive skin with Centella Asiatica, Niacinamide to support hydrating & brightening."
511,CeraVe Hydra AHA/BHA Repair Essence,CeraVe,Essence,All,AHA/BHA; Green Tea; Centella Asiatica; Allantoin,Barrier repair; Hydrating; Oil control,100,572000,4.4,35136,https://raw.githubusercontent.com/github/explore/main/topics/linux/linux.png?seed=skincare511,"Essence for all skin with AHA/BHA, Green Tea to support barrier repair & hydrating."
512,Pyunkang Yul Calm Green Tea Repair Essence,Pyunkang Yul,Essence,Sensitive,Green Tea; Ceramide; Vitamin C,Oil control; Anti-acne,50,159000,3.8,13444,https://raw.githubusercontent.com/github/explore/main/topics/mongodb/mongodb.png?seed=skincare512,"Essence for sensitive skin with Green Tea, Ceramide to support oil control & anti-acne."
513,Safi Advanced Centella Asiatica UV Shield,Safi,Sunscreen,Oily,Centella Asiatica; Vitamin C; Peptide; Retinol,Anti-aging; Oil control,70,88000,4.8,281,https://raw.githubusercontent.com/github/explore/main/topics/postgresql/postgresql.png?seed=skincare513,"Sunscreen for oily skin with Centella Asiatica, Vitamin C to support anti-aging & oil control."
514,Cosrx Glow Green Tea Face Oil,Cosrx,Facial Oil,Combination,Green Tea; Tranexamic Acid; AHA/BHA; Vitamin C,Anti-acne; Soothing,50,133000,4.4,5945,https://raw.githubusercontent.com/github/explore/main/topics/javascript/javascript.png?seed=skincare514,"Facial Oil for combination skin with Green Tea, Tranexamic Acid to support anti-acne & soothing."
515,Neutrogena Glow Squalane Hydra Cream,Neutrogena,Moisturizer,Normal,Squalane; Ceramide,Anti-acne; Pore care; Anti-aging,20,90000,4.2,18814,https://raw.githubusercontent.com/github/explore/main/topics/react/react.png?seed=skincare515,"Moisturizer for normal skin with Squalane, Ceramide to support anti-acne & pore care."
516,Somethinc Pure Niacinamide Hydrating Toner,Somethinc,Toner,Oily,Niacinamide; Peptide,Oil control; Anti-aging,60,238000,4.4,5218,https://raw.githubusercontent.com/github/explore/main/topics/vue/vue.png?seed=skincare516,"Toner for oily skin with Niacinamide, Peptide to support oil control & anti-aging."
517,Somethinc Daily AHA/BHA Moisturizing Cream,Somethinc,Moisturizer,Sensitive,AHA/BHA; Salicylic Acid,Anti-acne; Soothing,40,156000,3.9,42359,https://raw.githubusercontent.com/github/explore/main/topics/angular/angular.png?seed=skincare517,"Moisturizer for sensitive skin with AHA/BHA, Salicylic Acid to support anti-acne & soothing."
518,Hada Labo Gentle AHA/BHA Hydra Cream,Hada Labo,Moisturizer,Dry,AHA/BHA; Peptide; Centella Asiatica,Anti-acne; Soothing; Pore care,80,343000,4.7,18894,https://raw.githubusercontent.com/github/explore/main/topics/nodejs/nodejs.png?seed=skincare518,"Moisturizer for dry skin with AHA/BHA, Peptide to support anti-acne & soothing."
519,Cetaphil Pro Salicylic Acid Resurfacing Serum,Cetaphil,Exfoliator,Sensitive,Salicylic Acid; AHA/BHA; Tranexamic Acid,Hydrating; Oil control; Barrier repair,100,191000,4.0,542,https://raw.githubusercontent.com/github/explore/main/topics/python/python.png?seed=skincare519,"Exfoliator for sensitive skin with Salicylic Acid, AHA/BHA to support hydrating & oil control."
520,Erha Daily Niacinamide Concentrate Serum,Erha,Serum,Dry,Niacinamide; Retinol; Ceramide,Pore care; Anti-aging; Barrier repair,50,148000,4.7,3966,https://raw.githubusercontent.com/github/explore/main/topics/java/java.png?seed=skincare520,"Serum for dry skin with Niacinamide, Retinol to support pore care & anti-aging."
521,Vaseline Calm Squalane Skin Essence,Vaseline,Essence,Combination,Squalane; Allantoin; AHA/BHA; Retinol,Hydrating; Anti-aging,50,73000,4.9,4657,https://raw.githubusercontent.com/github/explore/main/topics/go/go.png?seed=skincare521,"Essence for combination skin with Squalane, Allantoin to support hydrating & anti-aging."
522,L'Oreal Paris Advanced Centella Asiatica Moisturizing Cream,L'Oreal Paris,Moisturizer,Sensitive,Centella Asiatica; Peptide; Salicylic Acid; AHA/BHA,Pore care; Anti-aging; Barrier repair,20,304000,3.8,33222,https://raw.githubusercontent.com/github/explore/main/topics/ruby/ruby.png?seed=skincare522,"Moisturizer for sensitive skin with Centella Asiatica, Peptide to support pore care & anti-aging."
523,Innisfree Renew Tranexamic Acid Hydrating Toner,Innisfree,Toner,All,Tranexamic Acid; Hyaluronic Acid; Green Tea; Panthenol,Anti-aging; Soothing; Hydrating,100,265000,3.9,22301,https://raw.githubusercontent.com/github/explore/main/topics/php/php.png?seed=skincare523,"Toner for all skin with Tranexamic Acid, Hyaluronic Acid to support anti-aging & soothing."
524,Azarine Pure Tranexamic Acid Peeling Solution,Azarine,Exfoliator,All,Tranexamic Acid; Hyaluronic Acid,Pore care; Brightening; Barrier repair,20,387000,4.1,40376,https://raw.githubusercontent.com/github/explore/main/topics/swift/swift.png?seed=skincare524,"Exfoliator for all skin with Tranexamic Acid, Hyaluronic Acid to support pore care & brightening."
525,Cosrx Hydra AHA/BHA Nourishing Oil,Cosrx,Facial Oil,Combination,AHA/BHA; Tranexamic Acid; Panthenol,Soothing; Brightening,20,497000,4.2,19136,https://raw.githubusercontent.com/github/explore/main/topics/kotlin/kotlin.png?seed=skincare525,"Facial Oil for combination skin with AHA/BHA, Tranexamic Acid to support soothing & brightening."
526,Hada Labo Renew Ceramide Repair Oil,Hada Labo,Facial Oil,Sensitive,Ceramide; AHA/BHA; Centella Asiatica; Hyaluronic Acid,Pore care; Barrier repair; Brightening,20,320000,3.9,44743,https://raw.githubusercontent.com/github/explore/main/topics/docker/docker.png?seed=skincare526,"Facial Oil for sensitive skin with Ceramide, AHA/BHA to support pore care & barrier repair."
527,Avoskin Advanced Allantoin Bright Eye Cream,Avoskin,Eye Cream,Normal,Allantoin; Green Tea,Anti-aging; Pore care,30,279000,4.7,6244,https://raw.githubusercontent.com/github/explore/main/topics/kubernetes/kubernetes.png?seed=skincare527,"Eye Cream for normal skin with Allantoin, Green Tea to support anti-aging & pore care."
